{"attempt_id":"kf-P1Clhv3MOhnotpeBG9UMG0Fd","authorized_at":1793296434484,"expires_at":1793296436291,"gateway_workload":"spiffe://test/gateway","grant_digest":"f3e2a96421a3d8e9b6c69ad8f2fc62299074923181ce9e128dcdb9a3f01886c7","permit_id":"1de1f97c9ac23f3078d76b315b3455425e1586e75920d8e9d02cc82e9048c0ad","profile":"KF-BROKER-AUTHORIZATION-0.1-draft","registration_digest":"93013d3f674d3ed8423a2ebfde59f14f1a636e46c14ba26ee34fd43b89a3b01b","root_id":"kf-root-3d383464ccb663e4e6cdfe7556e7045d1d816e250606b968374aec0699b91ea5","target_audience":"https://127.0.0.1:56400/accept","target_scope":"node:drain"}